<?xml version="1.0" encoding="UTF-8"?>
<Menu xmlns="http://www.platform.com/gui/pmc_menu" xmlns:xsi="http://www.w3.org/2001/XMLSchema-instance"
	xsi:schemaLocation="http://www.platform.com/gui/pmc_menu pmc_menu.xsd">

	<MenuItems id="resourceTreeSource">
		<MenuItem id="cloud" label="@{pmc.tree.node.cloud.label}"
				icon="" status="" url="" layoutSourceId="" tabGroup=""
				highlightTabId="" aclResource="Main_host" aclPermission="1">
				<MenuItems>
					<MenuItem id="cloudHost" label="@{pmc.tree.node.cloud.hosts.label}"
						icon="" status="" url="/hfguiv6/#/cloudHosts" 
						tabGroup="" highlightTabId="" aclResource=""
						aclPermission="1" helpGroupId="resCloudHost">
					</MenuItem>
	                <MenuItem id="cloudRequest" label="@{pmc.tree.node.cloud.requests.label}"
	                    icon="" status="" url="/hfguiv6/#/requestInstances"
	                    tabGroup="" highlightTabId="" aclResource=""
	                    aclPermission="1" helpGroupId="resCloudRequest">
	                </MenuItem>
	                <MenuItem id="cloudScheduledRequests" label="@{pmc.tree.node.cloud.hf.sr}"
	                    icon="" status="" url="/hfguiv6/#/cloudrequests"
	                    tabGroup="" highlightTabId="" aclResource=""
	                    aclPermission="1" helpGroupId="resCloudRequest">
	                </MenuItem>
	                <MenuItem id="cloudRequestors" label="@{pmc.tree.node.cloud.hf.requestors}"
	                    icon="" status="" url="/hfguiv6/#/cloudRequestors"
	                    tabGroup="" highlightTabId="" aclResource=""
	                    aclPermission="1" helpGroupId="resCloudRequest">
	                </MenuItem>
	                <MenuItem id="cloudProviders" label="@{pmc.tree.node.cloud.hf.providers}"
	                    icon="" status="" url="/hfguiv6/#/cloudProviders"
	                    tabGroup="" highlightTabId="" aclResource=""
	                    aclPermission="1" helpGroupId="resCloudRequest">
	                </MenuItem>
					<MenuItem id="cloudConfiguration" label="@{pmc.tree.node.cloud.configuration.label}"
	                    icon="" status="" url="/hfguiv6/#/cloudConfiguration" 
	                    tabGroup="" highlightTabId="" aclResource=""
	                    aclPermission="1" helpGroupId="resCloudConfiguration">
	                </MenuItem>

				</MenuItems>
		</MenuItem>
	</MenuItems>
</Menu>
